{
  "@context": "https://w3id.org/everse/rs#",
  "@id": "https://w3id.org/everse/tools/dependabot",
  "@type": "SoftwareApplication",
  "applicationCategory": {
    "@id": "rs:ResearchInfrastructureSoftware",
    "type": "@id"
  },
  "appliesToProgrammingLanguage": [
    "Ruby",
    "JavaScript",
    "Python",
    "PHP",
    "Dart",
    "Elixir",
    "Elm",
    "Go",
    "Rust",
    "Java",
    ".NET"
  ],
  "description": "Automated dependency management service that continuously monitors research software dependencies for security vulnerabilities and updates, maintaining software security and reducing technical debt for long-term sustainability.",
  "hasQualityDimension": [
    { "@id": "dim:security", "@type": "@id" },
    { "@id": "dim:maintainability", "@type": "@id" }
  ],
  "howToUse": ["CI/CD", "command-line"],
  "isAccessibleForFree": true,
  "license": "https://spdx.org/licenses/MIT",
  "name": "Dependabot",
  "url": "https://github.com/dependabot",
  "indicators": {
  "Security": "measures Security by continuously monitoring dependencies for known vulnerabilities and automatically proposing updates to mitigate risks.",
  "Maintainability": "measures Maintainability by automating dependency updates, reducing technical debt, and ensuring software remains up to date with minimal manual effort."
},
"useCases": [
  "Automatically detect and fix vulnerable dependencies in CI/CD pipelines",
  "Keep software dependencies up to date with minimal manual intervention",
  "Reduce technical debt by regularly updating outdated libraries",
  "Improve software security posture through continuous dependency monitoring"
]
}
